Nombre,Categoria,Tipo de Contenido,Enlace,Descripcion,Enlace 2,Enlace 3,Enlace 4
DF 4x4,Paginas Web,Artículos y Rutas,DF4x4 Offroad México,"Rutas off-road, Aventuras todo terreno, Comunidad 4x4, Eventos off-road",,,
wildhogoverland,Paginas Web,Sistemas de Recuperación y Emergencia,- Wild Hog Overland,"Accesorios 4x4, Tienda de accesorios off-road, Radios UHF y VHF, Radios de 2 vías, Radios para vehículos off-road, Antenas para radios",,,
The Great Outdoors,Paginas Web,Artículos y Rutas,The Great Outdoors México,"Rutas off-road, Comunidad 4x4, Eventos off-road, Cursos, Exploración y aventura, Exploración y travesías",,,
Rutas y Aventuras,Paginas Web,Artículos y Rutas,Rutas y Aventura 4X4,"Rutas off-road, Rutas y senderos 4x4, Exploración y aventura",,,
EPIC Off-Road,Paginas Web,Articulos OffRoad,EPIC Off-Road,"Accesorios 4x4, Racks para Jeep, Defensas y protecciones",,,
Orc overland ,Paginas Web,Articulos OffRoad,Orc-Overland,"Tiendas de campaña, Tiendas de techo para vehículos, Roof tents",,,
Off road depot,Paginas Web,Articulos OffRoad,Off Road Depot,"Tienda de accesorios off-road, Suspensiones todo terreno",,,
Big Contry,Paginas Web,Articulos OffRoad,Big Country,"Accesorios 4x4, Equipamiento Overland, Snorkels y winches, Tienda de accesorios off-road, Defensas y protecciones",,,
SP Accesorios Off Road 4x4,Paginas Web,Articulos OffRoad,SP Accesorios,"Accesorios 4x4, Suspensiones todo terreno, Defensas off-road, Equipamiento Overland, Talleres especializados 4x4",,,
Camp Pro,Paginas Web,Articulos OffRoad,Camp Pro,"Accesorios para camping 4x4, Tiendas de campaña sobre ruedas",,,
"Todo en forja, muebles y mas",Paginas Web,Recomendaciones de Equipamiento,https://www.facebook.com/share/AXsMRZ7CsQFj7Bhc/?mibextid=LQQJ4d,"Parrillas para vehículos, Campamento sobre ruedas",,,
Emmanuel Beltran,Redes Sociales,Recomendaciones,emmanuel.beltrd - Link in Bio & Creator Tools | Beacons,Aventuras todo terreno,,,
OffRoad Solutions,Proveedores,Articulos OffRoad,https://www.offroadsolutions.com.mx/,"Talleres especializados 4x4, Suspensiones todo terreno, ""Snorkels, luces y suspensiones"", Accesorios 4x4, Equipamiento Overland, Defensas y protecciones, Winches eléctricos",,,
Pittman México,Proveedores,Equipamiento Off-Road,Pittman México,,,,
La Baja Overland,Instagram,Equipamiento Off-Road,https://www.instagram.com/labajaoverland?utm_source=ig_web_button_share_sheet&igsh=ZDNlZDc0MzIxNw==,"Tiendas de todo terreno, Tiendas de campaña para coche, Tiendas de campaña impermeables, Tiendas plegables para camionetas",,,
Toyotas Armour,Instagram,Fotos de Expediciones,https://www.instagram.com/toyotas.armour?utm_source=ig_web_button_share_sheet&igsh=ZDNlZDc0MzIxNw==,Comunidad 4x4,,,
TRE4X4 MEXICO,Instagram,Fotos de Expediciones,https://www.instagram.com/tre4x4mexico?utm_source=ig_web_button_share_sheet&igsh=ZDNlZDc0MzIxNw==,Comunidad 4x4,,,
Rural Road Equipment,Instagram,Articulos OffRoad,https://www.instagram.com/ruralroad4wd.mx?utm_source=ig_web_button_share_sheet&igsh=ZDNlZDc0MzIxNw==,"Racks para equipaje, Racks para roof tents, Accesorios 4x4",Rural Road Equipment,,
4x4rocklander,Redes Sociales,Recomendaciones,https://www.instagram.com/4x4rocklander?utm_source=ig_web_button_share_sheet&igsh=ZDNlZDc0MzIxNw==,"Rutas off-road, Aventuras todo terreno, Exploración y aventura, Cursos, Expediciones en México, Comunidad 4x4",https://www.youtube.com/@4x4rocklander,,
jugueteriaoffroad,Proveedores,Articulos OffRoad,https://www.instagram.com/jugueteriaoffroad?utm_source=ig_web_button_share_sheet&igsh=ZDNlZDc0MzIxNw==,"Accesorios 4x4, Tienda de accesorios off-road",,,
Overlander Mexico,Comunidad 4x4,Artículos y Rutas, https://www.facebook.com/share/MjYR9Ajtwwn5xVW1/,Comunidad 4x4,,,
Toyotero's Mexicanos,Comunidad 4x4,Artículos y Rutas,https://www.facebook.com/share/8cAYtBC9HSKoMusM/,,,,
Overland Hunters México,Perfil de Instagram,Fotos de Expediciones,https://www.instagram.com/overland_hunters_mexico?utm_source=ig_web_button_share_sheet&igsh=ZDNlZDc0MzIxNw==,"Comunidad 4x4, Aventuras todo terreno",,,
Adolfo Romero,Perfil de Instagram,Articulos OffRoad,https://www.instagram.com/offroad.beasts.garage?utm_source=ig_web_button_share_sheet&igsh=ZDNlZDc0MzIxNw==,Aventuras todo terreno,,,